page,title,info
http://www.getty.edu/art/collection/objects/337384/veit-stoss-corpus-christi-german-about-1490-1500/,Corpus Christi,"Intended for private devotion, this small-scale statuette offers a compelling depiction of the crucified Christ with a dramatic, expressive face and a captivating, realistic body (corpus in Latin). The leading artist of his generation, Stoss worked in both Germany and Poland. He achieved fame for his exceptional virtuosity in carving wood in particular, as seen in the highly detailed curls of the hair and beard, folds and fringe of the drapery, swollen veins in Christ’s arms and legs, and wrinkles and mouth of the face."
http://www.getty.edu/art/collection/objects/226276/francois-thomas-germain-la-machine-d'argent-or-centerpiece-for-a-table-surtout-de-table-french-1754/,"""La Machine d'Argent"" or Centerpiece for a Table (surtout de table)","This unusual silver sculpture represents two birds, a rabbit, and a variety of vegetables. Lying on its side, the small rabbit is flanked by the game birds: an ortolan and a snipe with a long beak. A cauliflower with raggedly trimmed stalk and leaves rises above the animals. The still life also includes an onion, a turnip, a gherkin, a truffle, and a morel mushroom. Leafy plants peek out at the edges of a rocky ground evoking the earthen floor of a wood or glade.  "
http://www.getty.edu/art/collection/objects/326677/desiderio-da-settignano-bust-of-a-young-boy-italian-about-1460-1464/?dz=,Bust of a Young Boy,"This marble bust, cut just under the shoulders, represent a little boy of a very young age, probably around three years-old. Wearing a very fine tunic, he slightly turns his head to his left, his semi-opened eyes marked by a pensive gaze and his closed lips barely outlining the hint of a smile. The marble is skillfully carved as to evoke the smooth skin of the cheeks, the chubby flesh of the neck, and the silky hair whose elegantly intertwined locks are masterfully rendered in very low relief."
http://www.getty.edu/art/collection/objects/328670/auguste-rodin-bust-of-john-the-baptist-french-model-1880-cast-1886/?dz=,Bust of John the Baptist,"This bronze bust represents John the Baptist, the itinerant preacher who baptized Jesus Christ and is commonly considered his precursor. Rodin’s depiction is very natural and realistic: John’s long hair and beard, along with his sunken cheeks and bony chest, evoke the ascetic life the preacher lived in the desert. In addition, the deep holes with which the eyes are pierced, giving the illusion of an intense gaze, the open mouth and the chin slightly risen up convey the intense concentration and sincere faith of the saint's preaching act. Thus, a strikingly spiritual expression emanates from the figure."
http://www.getty.edu/art/collection/objects/5806/beauvais-manufactory-woven-under-the-direction-of-philippe-behagle-after-cartoons-by-guy-louis-vernansal-et-al-tapestry-les-astronomes-from-l'histoire-de-l'empereur-de-la-chine-series-french-about-1697-1705/,"Tapestry: Les Astronomes, from L'Histoire de l'empereur de la Chine Series","In a tapestry from the series known as The Story of the Emperor of China, European and Chinese figures assemble on a stone terrace around an elaborately mounted globe. In the center of the group stands the Chinese emperor, wearing the imperial insignia of the winged dragon and gesturing with one hand while the other rests possessively on the globe. The bearded man taking a measurement on the globe with a pair of dividers is the German Jesuit priest Father Schall von Bell, who attained a high rank in the Qing court through his knowledge of Western astronomy. He headed the Imperial Astronomical Bureau and developed a close personal relationship with the emperor, based on a shared interest in mathematics and astronomy."
http://www.getty.edu/art/collection/objects/226430/peter-paul-rubens-the-calydonian-boar-hunt-flemish-about-1611-1612/,The Calydonian Boar Hunt,"-Ovid, "
http://www.getty.edu/art/collection/objects/333122/eustache-le-sueur-crucifixion-french-about-1650-1655/,Crucifixion,"Le Sueur depicts Christ on the cross, still alive, alone in a rocky and mountainous landscape. Following an older tradition in art, he is represented attached to the cross with four nails. As he hangs dying, blood trickles from his feet and hands onto the cross and the rock of Golgotha, symbolizing the Christian belief that his death cleansed the original sin of Adam, whose skull is displayed below. There is a sense of absolute stillness, broken only by the suggestion that the open-mouthed Christ is pronouncing his last words: “My God, my God, why have you forsaken me?” (Matthew 27:46; Mark 15:34). The relatively small size, the delicacy of the brushwork, and the precious support on copper indicate that the painting was intended for private devotion."
